{"algorithm":"reproassert-v02-dataset-container-attestation-v1","container_inspection_sha256":"1482100e3617c88624e3f7ea43b8b500b138bfa5471011e01900543a2e4c4b03","image_digest":"sha256:0bf07669fd085b608e6859b90a486b3ede52d8cc409309410181ab32fbe1118f","inputs":{"id_list_sha256":"d4a725758956230f4cf24e1adc2d01eeb18d6a04d726ae4bb2a73204bea33ec1","parquet_sha256":"a45b1fe4e2f0c8390b2b2938ac83e92ed5979000856808f3679c07812e9e6dcd","projection_request_sha256":"0f926442435f038cb63dfbbc2afd680fce5af5f4d85ab9648a6e83cbfd2cf5b4","worker_sha256":"28b626f8abf2729d542abf971dd9dfb14dacc6f6a2b67ab8104d22dbecf18f7b"},"parser_output_bytes":356168,"parser_output_sha256":"b441333691eb0deb1f5f7b63530483772a7893590582f4f522d2d47dd568f9c7","parser_receipt_sha256":"67f337d762536333e06821e91cc1a85dc37ae2b86c14af26057cd090685f96ae","policy":{"capabilities_dropped":"ALL","cpus":1.0,"environment_cleared_with_env_i":true,"host_credentials_forwarded":false,"input_mount_read_only":true,"memory_bytes":1073741824,"memory_swap_bytes":1073741824,"network_mode":"none","no_new_privileges":true,"pids":32,"privileged":false,"read_only_root":true,"timeout_seconds":60.0,"tmpfs_bytes":16777216,"user":"65532:65532"},"production_eligible":true,"upstream_evidence_sha256":"ea68fc3aa8754e13929e4532fd9ad0cc03ff8614dad41165417ca07bbb00a70c"}
